Dana - Dana,"Dana-Dana adalah sebuah tarian tradisional yang berasal dari daerah Gorontalo. Dipergunakan dalam berbagai acara seperti penyambutan tamu, pernikahan, dan kegiatan keagamaan, tarian ini menyajikan aspek hiburan dan penghibur dalam budaya lokal. Awalnya diciptakan untuk remaja Muslim dengan tujuan menghibur, mempererat silaturahmi, serta menjadi sarana penyebaran agama Islam melalui syair yang dinyanyikan selama pertunjukan tari Dana-Dana. Meskipun asalnya dari Arab Saudi, tarian ini tersebar di seluruh negeri dengan variasi lirik lagu dan gerakan yang mengikuti pengaruh budaya lokal. Fungsi sosial tarian Dana-Dana meliputi peranannya dalam memeriahkan acara penyambutan tamu atau perayaan hari besar di Gorontalo. Lebih dari sekadar hiburan, tarian ini juga diartikan sebagai ungkapan rasa syukur dan kebahagiaan dalam kegiatan sosial. Tari Dana-Dana juga berfungsi sebagai media pergaulan masyarakat dan penyampaian pesan-pesan terkait agama Islam melalui gerakan dinamis dan energiknya. Pengiringnya biasanya menggunakan alat musik seperti rebana dan gambus dengan lagu-lagu yang berisi pantun dan pesan kehidupan. Dalam setiap pertunjukannya, tarian Dana-Dana menampilkan gerakan dinamis yang menggerakkan hampir seluruh bagian tubuh dengan tempo yang cepat. Gerakan energik ini diiringi dengan irama musik yang mendukung kecepatan gerakan para penari. Penyajian tarian ini juga memperhatikan kostum yang biasanya mengkombinasikan pakaian adat dengan unsur-unsur busana Muslim. Penari wanita mengenakan pakaian tertutup dengan jilbab, sementara penari pria menggunakan pakaian adat yang sering dihias dengan elemen Timur Tengah untuk menambah daya tarik visual pada pertunjukan.",Seni Pertunjukan
Dikili,"Dikili memiliki naskah yang berisi ungkapan dan kisah yang ditampilkan melalui lagu yang tersedia dalam Bahasa Arab, Bahasa Indonesia, dan Bahasa daerah Gorontalo. Tradisi ini dilakukan oleh masyarakat Gorontalo sebagai bagian dari perayaan Maulidan atau peringatan hari kelahiran Nabi Muhammad SAW, yang dilaksanakan dalam waktu sekitar 16-17 jam. Fungsi Dikili ini penting dalam upacara keagamaan khususnya maulidan oleh Masyarakat Gorontalo. Dalam pelaksanaannya, para tukang dikili melagukan kata-kata pujaan terhadap Nabi Muhammad SAW. Tradisi Dikili melibatkan partisipasi Masyarakat dengan memberikan sumbangan berupa uang atau sajian untuk dibagikan kepada tukang dikili atau Ahlul yang memimpin doa. Para tukang dikili, baik laki-laki maupun Perempuan melagukan kata-kata pujaan terhadap Nabi Muhammad SAW dalam berbagai variasi lagu yang berjumlah lebih dari 300 dan menceritakan 16 kisah kelahiran Nabi Muhammad. Proses pelaksanaan Dikili dimulai setelah Shalat Isya dengan doa yang dipimpin oleh Ahlul. Tradisi Dikili juga diakhiri dengan doa bersama dan pembagian uang atau sajian sebagai ungkapan rasa syukur dan penghargaan kepada para pelaksana dan pemimpin upacara.","Adat Istiadat Masyarakat, Ritus, dan Perayaan-Perayaan"
Lohidu,"Lohidu tradisi lisan dari Gorontalo, di mana penutur yang menyampaikan cerita-cerita lisan diiringi oleh alat musik semacam gitar. Penampilan lohidu bisa dilakukan di berbagai tempat, seperti di sawah/kebun, di danau, di pasar, pesta, atau tempat pertunjukan seni. Tradisi Lohidu berperan sebagai bentuk hiburan rakyat yang mengisi acara-acara seni di pesta, keramaian, atau acara sosial politik. Selain itu, lohidu juga berfungsi sebagai sarana untuk menghilangkan rasa lelah  setelah bekerja atau bahkan bisa dilakukan sambil bekerja di sawah/kebun, danau, pasar, serta tempat-tempat pertunjukan seni. Cerita-cerita lisan yang disampaikan dalam lohidu mungkin mencakup beragam tema, dari cerita rakyat, legenda, kisah sejarah, hingga cerita-cerita moral atau kebijaksanaan. Lohidu mengandalkan alat musik semacam gitar sebagai pengiring dalam penyampaian cerita-cerita lisan. Prosesnya melibatkan seorang penutur yang disebut tukang lohidu, yang secara lisan menyampaikan cerita-cerita dengan diiringi alunan musik dari gitar.",Tradisi dan Ekspresi Lisan
Me'Eraji,"Me’Eraji adalah aktivitas kebudayaan masyarakat di Gorontalo berupa pembacaan naskah tertentu untuk memperingati Isra’ Mi’raj Nabi Muhammad SAW yang dibawakan oleh para imam (leebi) dan pemangku adat di rumah penyelenggara Me’Eraji. Fungsi sosial Me’Eraji adalah sarana untuk memperkuat hubungan spiritual antara masyarakat Gorontalo dengan Tuhan Yang Maha Esa. Secara khusus setiap prosesi Me’Eraji memiliki tujuan tertentu, misalnya Me’Eraji untuk mencegah malapetaka, menyembuhkan penyakit, mendapatkan berkah dan pahala dari Allah, serta memohon berbagai kebaikan dan rezeki kepada-Nya. Dalam pelaksanaan Me'eraji, peran ta mome'erajia sebagai pembaca naskah sangat penting. Mereka duduk di kursi di depan pendengar dengan meja tempat meletakkan naskah. Naskah Me'eraji yang dibacakan dengan berlagu memiliki isi cerita yang mengisahkan peristiwa Isra'-Mi'raj Nabi Muhammad SAW. Selain itu, Me'eraji juga melibatkan masyarakat dari berbagai kelompok usia dan gender, baik sebagai pembaca maupun pendengar.",Tradisi dan Ekspresi Lisan
Pulanga,"Pulanga adalah upacara adat yang berasal dari suku Gorontalo di Sulawesi Utara. Upacara ini biasanya dilakukan untuk menyambut kepulangan seseorang yang telah lama meninggalkan desa atau pulau, seperti anak yang merantau, atau saudara yang bekerja di luar daerah. Pulanga berfungsi sebagai silaturahmi antara keluarga, saudara, dan komunitas di desa dan doa syukur atas keselamatan dan keberhasilan yang mereka alami selama perantauan. Proses pelaksanaan Pulanga membutuhkan tarian dan musik tradisional. Pakaian adat khas Gorontalo dipakai oleh peserta upacara, yang akan menari dan menyanyikan lagu-lagu khas daerah untuk merayakan kepulangan orang-orang tercinta. Prosesi upacara melibatkan berbagai rangkaian acara, termasuk sambutan, doa bersama, tarian, dan perayaan makanan bersama.","Adat Istiadat Masyarakat, Ritus, dan Perayaan-Perayaan"
Tidi Lo Malu'o,"Tidi Lo Malu'o adalah salah satu dari tujuh jenis tarian yang ditarikan oleh putri kerajaan dan dayang istana di Gorontalo. Tarian ini terinspirasi dari gerakan ayam yang berjalan dengan gemulai dan gerakan yang indah. Diciptakan untuk menggambarkan gerak gemulai ayam, Tidi Lo Malu'o disinyalir memiliki pengaruh budaya Islam di Gorontalo dan mulai muncul saat pemerintahan Raja Eyato. Pada awalnya, tarian ini ditarikan pada acara pernikahan bangsawan oleh puteri bangsawan, pejabat negara, dan pemangku adat. Sejak abad ke-17 dan ke-18, Tidi Lo Malu'o menjadi tarian klasik yang berkembang di kalangan bangsawan Gorontalo dan secara khusus dipertunjukkan dalam upacara adat pernikahan. Namun, saat ini tarian ini dapat dipertunjukkan pada acara penyambutan tamu besar seperti Gubernur, Bupati, dan Walikota. Fungsi sosial Tidi Lo Malu'o mencakup penggunaan tarian ini sebagai bagian dari ekspresi budaya Gorontalo yang mencerminkan tata kehidupan masyarakatnya. Tarian ini mengandung pesan moral dan nasehat bagi remaja puteri, mengajarkan keuletan dalam melakukan pekerjaan sehari-hari, rajin beribadah, dan menyerap nilai-nilai Islam. Awalnya hanya ditarikan di lingkungan istana, namun seiring waktu, tarian ini juga dihadirkan dalam acara resmi hiburan serta acara kesenian untuk menyambut tamu. Melalui properti, busana adat, hiasan dada, hiasan kepala, dan gerak-geriknya, Tidi Lo Malu'o mengungkapkan makna dan nilai-nilai yang diterima dari aspek agama, moral, dan pendidikan. Pelaksanaan Tidi Lo Malu'o melibatkan puteri bangsawan, wali-wali mowali (pemuka adat), dan tokoh masyarakat sebagai pelaku tarian. Tari ini biasanya ditarikan oleh lima orang penari dengan menggunakan busana adat madipungu/wolimomo dengan lima tangkai sunthi diatas konde. Properti yang digunakan adalah tangkai yang berhiaskan bulu ayam. Musik pengiringnya adalah musik etnis khas Gorontalo. Tarian ini memiliki syair lagu yang diiringi dalam pelaksanaannya. Meskipun pada awalnya hanya terbatas pada lingkungan istana, penggarapan kembali Tidi Lo Malu'o dilakukan pada sekitar tahun 1970-an untuk mencegah punahnya tarian ini, sehingga menjadi bagian penting dari warisan budaya Gorontalo yang dilestarikan.",Seni Pertunjukan
Tidi lo Tihu'o,"Tidi Lo Tihu'o adalah jenis tarian tradisional Gorontalo yang khusus dipentaskan di kalangan istana raja (Yiladia lo Olongia) pada zaman dahulu. Istilah ""tidi"" merujuk pada tarian khusus yang awalnya dikembangkan di lingkungan istana, sedangkan ""tihu'o"" mengacu pada rantai yang terbuat dari manik-manik dengan warna adat Gorontalo. Tidi Lo Tihu'o berfungsi sebagai hiburan bagi pembesar negeri, terutama raja dan permaisurinya. Tarian ini melambangkan kehalusan budi pekerti, persatuan, dan kesatuan antara orang tua, masyarakat, dan lingkungan. Proses pelaksanaan Tidi Lo Tihu'o melibatkan penari putri bangsawan dari kalangan olongia (raja) dan pejabat-pejabat negeri yang memakai busana adat bili'u dengan hiasan rambut berbentuk kotak-kotak dari perak bersepuh emas. Alat tari yang digunakan adalah rantai yang terbuat dari mutiara, yang panjangnya sekitar 1 meter dan disematkan pada jari tengah saat menari. Musik pengiring menggunakan alat musik rebana dan lagu ""Tidi Lo Tihu'o"" dinyanyikan oleh group musik rebana. Tari ini dapat dilakukan pada berbagai acara seperti malam pertunangan, malam resepsi pernikahan, serta upacara adat lainnya.",Seni Pertunjukan
Wunungo,"Wunungo adalah nyanyian tradisional dalam budaya Gorontalo yang memiliki makna dan fungsi penting dalam kegiatan tadarus Alqur'an. Syair-syair dalam Wunungo berisikan penghormatan, anjuran, dan ucapan terima kasih, dan biasanya dilakukan secara berkelompok. Wunungo berfungsi sebagai selingan untuk memperbaiki cara mengaji bagi mereka yang sering salah dalam membaca Alqur'an, Wunungo juga digunakan sebagai pujian kepada Allah dan para Nabi. Proses pelaksanaannya, Wunungo dilantunkan secara bersama-sama atau berkelompok dengan menggunakan suara manusia sebagai instrumen utamanya. Namun, dalam beberapa situasi, Wunungo dilakukan dengan mengiringi permainan musik sederhana seperti gambus atau seruling.",Tradisi dan Ekspresi Lisan
Wunungo,"Wunungo adalah nyanyian tradisional dalam budaya Gorontalo yang memiliki makna dan fungsi penting dalam kegiatan tadarus Alqur'an. Syair-syair dalam Wunungo berisikan penghormatan, anjuran, dan ucapan terima kasih, dan biasanya dilakukan secara berkelompok. Wunungo berfungsi sebagai selingan untuk memperbaiki cara mengaji bagi mereka yang sering salah dalam membaca Alqur'an, Wunungo juga digunakan sebagai pujian kepada Allah dan para Nabi. Proses pelaksanaannya, Wunungo dilantunkan secara bersama-sama atau berkelompok dengan menggunakan suara manusia sebagai instrumen utamanya. Namun, dalam beberapa situasi, Wunungo dilakukan dengan mengiringi permainan musik sederhana seperti gambus atau seruling.",Tradisi dan Ekspresi Lisan
